Loan Agreement,7.3 b,"(b)   Review of management 
The Lender shall be entitled to the right to review the management set-up or organization of the Borrower and to require the Borrower to restructure it as may be considered necessary by the Lender, including the formation of management committees with such powers and functions as may be considered suitable by the Lender, if in the opinion of the Lender the business of the Borrower is conducted in a manner opposed to public policy or in a manner prejudicial to the Lender’s interests. Further any person, by whatever name called, exercising substantial powers of management shall not be paid any commission in any year unless all the dues of the Lender in that year have been paid to the satisfaction of the Lender.",,Full Lifecycle,Informative,Non Financial - Informative,Consequence EOD,Change Management,,Management Confirmation(s),Event Based,,,,,,
Loan Agreement,7.3 c,"(c)   Call for Unsubscribed/Uncalled Project Equity Capital 
The Lender shall be entitled to call upon the Promoters and other shareholders of the Borrower who have agreed to contribute to the Project Equity Capital to pay to the credit of the relevant Retention Account the uncalled capital in respect of shares already issued by the Borrower and the unsubscribed portion of the Project Equity Capital. ",,Full Lifecycle,Informative,Non Financial - Informative,Consequence EOD,Call Equity,,Management Confirmation(s),Event Based,,,,,,
Loan Agreement,,"(d)   Default Conversion Right
(i)	If the Borrower commits a default in two consecutive payment of Interest or repay¬ment of principal installments or any combination thereof and such default continues for a period of 30 days then, the Lender shall have the right to convert (which right is hereinaf¬ter referred to as the “Default Conversion Right”) at its option whole or part of the defaulted amount of the Loan into fully paid-up equity shares of the Borrower, at par, in the manner specified in a notice in writing to be given by the Lender to the Borrower (which notice is hereinafter referred to as the “Default Notice of Conversion”), prior to the date on which the conversion is to take effect, which date shall be specified in the said notice (the “Default Date of Conversion”). 

(ii)	In the event the Default Conversion Right is to be exercised by the Lender, such conversion shall be subject to Clauses 5.3, 7.1(k) and other relevant provisions of the Concession Agreement.

(iii)	On receipt of the Default Notice of Conversion, the Borrower shall allot and issue the requisite number of fully paid-up Equity Shares to the Converting Lender, as from the Default Date of Conversion and the Converting Lender shall accept the same in satisfaction of the principal amount of the Loan to the extent so converted. The part of the Loan so converted, shall cease to carry interest as from the Default Date of Conversion and the Loan shall stand correspondingly reduced. Upon such conversion, the installments of the Loan payable after the Default Date of Conversion as per the Amortization Schedule provided in this Agreement, shall stand reduced proportionately by the amounts of the Loan so converted. The equity shares so allotted and issued to the Converting Lender shall carry, from the date of conversion, the right to receive proportionately the dividends and other distributions declared or to be declared in respect of the Equity Capital of the Borrower. Save as afore¬said, the said shares shall rank pari passu with the existing Equity Shares of the Borrower in all respects. The Borrower shall, at all times, maintain sufficient unissued Equity Shares for the above purpose. 

(iv)	The Default Conversion right reserved as aforesaid, may be exercised by the Lender, on one or more occasions during the currency of the Loan. 


(v)	For the purposes of this Section 7.3 (d), it shall not be construed as a default, if the Borrower approaches the Lender well in advance for postponement of principal or interest on the Loan, as the case may be, and only if the Lender agrees to the same.",,Full Lifecycle,Informative,Non Financial - Informative,Consequence EOD,Conversion Equity,,Management Confirmation(s),Event Based,,,,,,
Non Disposal Undertaking - Yes Bank,ii,"(ii)	we shall, immediately upon acquisition/receipt of any future shareholding in the Borrower, inform the Lenders details of such acquired/received shares; the Certificates of such further acquired/ received shares shall also be kept by us in our custody; (the shares held by us as on the date of this undertaking together with the shares which may be acquired at any time during the term of the Finance Documents is herein after referred as ""NDU Shares"");",,Full Lifecycle,Informative,Non Financial - Affirmative,Security Related,Additional Security,,Official Documents,Event Based,Acquisition of shares,,,,Medium,
Non Disposal Undertaking - Yes Bank,iii,"(iii)	so long as any outstandings remain due and payable by the Borrower to the Finance Parties under the Finance Documents or so long as the Borrower creates  Security  including mortgage over the Additional Immovable Properties by executing amended  Borrower Mortgage in terms of the Facility Agreement (in a form and substance satisfactory to the Lenders), whichever is earlier:

(a)	we shall continue to remain the sole and exclusive legal and beneficial owner of the NDU Shares;

(b)	we shall not without the prior written consent of the Lenders, create or attempt to create or agree to or permit the creation  of any Security  on the  NDU Shares  in favour of any person; and the creation of any Security or an attempt to create any Security on the NDU Shares without the prior written consent of the Lenders shall be null and void and shall be deemed to be a breach of this undertaking and an Event of Default under the Finance Documents;

(c)	we shall not assign or transfer the NDU Shares or any number of NDU Shares, all or any of our rights, benefits and/or obligations relating to the NDU Shares and other related deeds and documents without the prior written approval of the Lenders;",,Full Lifecycle,Informative,Non Financial - Negative,Security Related,NDU,,Official Documents,Quarterly,26/11/11,,"Creation of Mortgage, condition falls once mortgage is created",,Medium,
Non Disposal Undertaking - Yes Bank,iii,"(d)	we shall furnish to the Lenders a declaration, within 15 days from the end of each financial year, as per the format given in Annexure B hereto, inter alia, to the effect that we continue to hold NDU shares of the Borrower.",,Full Lifecycle,Informative,Non Financial - Negative,Security Related,Other Documents - Format,,Other Documents - Format,Annually,Financial Year End,15,"Creation of Mortgage, condition falls once mortgage is created",,Medium,
Non Disposal Undertaking - Yes Bank,Others - iii,"(e)	we shall procure and furnish to the Lenders, a certificate from the Borrower's statutory auditors, within 15  (fifteen) days from the  end of each financial year, as per the format given in Annexure C, inter alia, to the effect that they have physically verified the Register of the Members of the Borrower and the share certificates held by the abovementioned Promoters and that at the end of the financial year the abovementioned Promoters, continue to hold the NDU shares of the Borrower.",,Full Lifecycle,Informative,Non Financial - Negative,Security Related,Other Documents - Format,,Other Documents - Format,Annually,01/04/12,,"Creation of Mortgage, condition falls once mortgage is created",,Medium,
Non Disposal Undertaking - Axis Bank,i,"In addition to the security furnished and created by the Borrower and the Promoters in favour of the Lenders pursuant to the Facility Agreement, we, hereby, unconditionally and irrevocably agree and  undertake that the Borrower shall create (i) a first ranking charge by way of mortgage in trust and for the benefit of the Lenders over the Additional Immovable Property of the Borrower together with buildings and structures thereon and all plant and machineries attached to the earth or permanently fastened to anything attached to the earth, from time to time, in order to maintain asset coverage of 2.0x at all times, corresponding to the Secured Obligations as also over any such property created out of the proceeds of the Facility",,Full Lifecycle,Security,Financial -Affirmative,Ratios,Security Cover Ratio,,Financial Ratio Computations,Quarterly,26/11/11,,,2x,High,
Non Disposal Undertaking - Axis Bank,ii,"(ii) a subservient charge by way of mortgage in trust and for the benefit of the Lenders over the immovable properties more particularly specified in Schedule attached hereto, together with buildings and structures thereon and all plant and machineries attached to the earth or permanently fastened to anything attached to the earth (together the immovable properties to be charged on first charge and subservient charge basis are hereinafter referred to as the ""Secured Immovable Fixed Assets"") in favour of the Security Trustee acting in trust and for the benefit of the Lenders for the due performance and repayment of all Secured Obligations, the said security being provided in consideration for the Facility granted under the Facility Agreement and that the same is good and valuable consideration.",,Full Lifecycle,Security,Financial -Affirmative,Security Related,Mortgage,,Official Documents,Quarterly,26/11/11,,,,High,
Non Disposal Undertaking - Axis Bank,Others,"We confirm and declare that the Borrower will create charge by way of mortgage in favour of the Security Trustee on the Secured Immovable Fixed Assets within a period of 90 (ninety) days (which may be further extended by a period 90 (ninety} days with the  prior written  approval  of  the Lenders, which approval shall not be unreasonably withheld) from the date of the  Facility Agreement, TO HAVE AND TO  HOLD all and  singular  the Secured  Immovable  Fixed Assets unto the Security Trustee acting in trust and for the benefit  of  the  Lenders  in  accordance  with these presents absolutely UPON TRUST and subject to the powers and provisions declared and contained herein and in other Finance Documents.",,Post-Disbursement (CS),Security,Non Financial - Affirmative,Management Confirmation,Security Creation,,Official Documents,Quarterly,26/11/11,,24/05/12,,High,
Non Disposal Undertaking - Axis Bank,Others,"Furthermore, we shall have the immovable properties in relation to the Secured  Immovable  Fixed Assets registered  in  the  books/records  of the relevant sub-registrar of Assurances to  the  satisfaction  of  the  Security Trustee within this period of 90 (ninety) days from  the  date of  the  Facility Agreement  (or such further  extended period 90 of {ninety} days with the prior written approval of the  Lenders, which approval shall not be unreasonably withheld).",,Post-Disbursement (CS),Security,Non Financial - Affirmative,Management Confirmation,Security Creation,,Official Documents,Quarterly,26/11/11,,24/05/12,,High,
"Security Trustee
Agreement",2.2.2,"2.2.2	The Borrower shall create the Security in favour  of the Security Trustee for  the benefit of the Finance Parties"" in accordance with the terms and conditions of the Finance Documents. The Security Trustee shall hold the Security to be created under the respective Security Documents for the benefit of the Finance Parties in accordance with the terms thereof.",,Post-Disbursement (CS),Security,Non Financial - Affirmative,Management Confirmation,Security Creation,,Official Documents,Event Based,26/11/11,,,,High,
"Security Trustee
Agreement",6.4,"6.4.1 (a)	The Borrower undertakes to  the  Security Trustee that it  shall  comply with the covenants and undertakings contained in the Finance Documents and those contained in this Section 6.4 and such covenants  and undertakings shall remain in full force and effect until the discharge of the Secured Obligations. In addition to  the covenants and undertakings  by the  Borrower in the Finance Documents, the Borrower undertakes and agrees with the Security Trustee that, throughout the continuance of this Agreement and so long as the Secured Obligations or any part thereof remain owing, the Borrower will, unless the Security Trustee otherwise agrees:

(i)	punctually pay all rents, rates, Taxes and outgoings in connection with any part of Secured Property so as to keep the same free from any other security interest, other than the  Security  created  under the Security Documents; and

(ii)	if any penalty or legal costs or any other charges are paid by the Finance Parties (upon the Borrower's failure to pay) for the stamping and registration of any of  the  Security Documents or any supplement or addition thereto or any other additional Security Documents under Section 6.4.2 below, pay to such Secured Party the amount thereof with interest and Default Interest at the Default Rate in accordance with the applicable Finance Document and also deliver to the Security Trustee certified copies of the receipts evidencing payment of stamp duty and other charges in connection with the stamping and registration of the Security Documents.

6.4.2	Additional Property

The Borrower does hereby affirm the covenants given by it in  the  Finance Documents in relation to additional property including any Additional Immovable Property acquired by the Borrower and shall charge the same in  favour  of the Security Trustee by way of first charge by creation of a mortgage for  the  benefit of the Finance Parties and such other Persons (including the Transferee Lenders) as may be instructed by the Agent in such form and manner as may be decided by the Security Trustee.",,Full Lifecycle,Security,Financial -Affirmative,Commercial,Transaction Fees And Charges,,,Event Based,26/11/11,,,,Low,
"Security Trustee
Agreement",7.2,"The Borrower hereby acknowledges and agrees that pursuant to the  Fee  Letter,  the Borrower has agreed to pay to the Security Trustee  fee for services performed by the Security Trustee under or pursuant to this Agreement, and to pay or reimburse all out-of­ pocket, legal, travelling and other costs, charges and expenses (""Expenses"") incurred by the Security Trustee in the proper  discharge of  its  duties under this Agreement,  within a period of 30 (thirty) days from the date of notice of demand from the Security Trustee. The Security Trustee agrees to provide adequate details of such Expenses, if required by the Borrower. In the event the  above payments  are not  made within the said period of 30 (thirty) days from the date of notice of demand from the Security Trustee, the  Borrower shall pay, on the overdue amount from the date of demand till payment, interest calculated at the  rate of 3% per annum.",,Full Lifecycle,Financial,Financial -Affirmative,Commercial,Transaction Fees And Charges,,,Event Based,26/11/11,30,,,Low,
Facility Agreement,3.1,"
The Borrower shall apply all amounts borrowed by it under the Facility for the purposes of (i) developing and levelling certain land and expanding CFS facility at village Somathane, district Panvel, state Maharashtra, India; (ii) incurring expenses for any conversion/modification/ alteration of certain existing CFS at village Ajwali, district Raigad, state Maharashtra, India to hazardous cargo CFS; and (iii) any other purpose as may be agreed to by the Lenders in writing in their discretion",,Full Lifecycle,Informative,Non Financial - Affirmative,Certificate,End Use Certificate,,CA Certificate,Quarterly,26/11/11,,,,Medium,
Facility Agreement,5.1,The Borrower may utilise the Facility by delivery to the Agent of a duly completed Utilisation Request not later than 11:00 a.m. Mumbai time at least 3 (three) Business Days prior to the proposed Utilisation Date.,,Full Lifecycle,Informative,Non Financial - Informative,Management Confirmation,Transaction Documents,PDC(1-n),Official Documents,Event Based,Disbursment Date,-3,,,High,
Facility Agreement,7.3,"7.3.	Mandatory Prepayment

In the event:

(ii)	the Borrower receives any liquidated damages or proceeds in connection with breach of warranties; and

",,Full Lifecycle,Financial,Financial -Affirmative,Prepayment,Mandatory,,,Event Based,26/11/11,,,,High,
Facility Agreement,7.3,"(iii)	the borrower receives any proceeds from sale or transfer of moveable or immovable properties which is in excess of Rs 50,000,000 (Rupees Five Crores) in any financial year;

or any other event as may be notified by the Lenders from time to time, the Borrower shall mandatorily prepay the Loan or the amount so received by the Borrower, as the case may be.",,Full Lifecycle,Financial,Financial -Affirmative,Prepayment,Mandatory,,,Event Based,26/11/11,,,,High,
Facility Agreement,7.3,"7.3.	Mandatory Prepayment

In the event:

(i)	the ownership/management structure of the Borrower is altered materially as determined by the Lenders in their discretion;",,Full Lifecycle,Financial,Financial -Affirmative,Prepayment,Mandatory,,,Event Based,Event Date,,,,High,
Facility Agreement,10.4,"10.4.	Stamp taxes

The Borrower shall (a) pay and, (b) within 3 (three) Business Days of demand, indemnify each Finance Party against any cost, loss or liability that Finance Party incurs in relation to all stamp duty, registration and other similar Taxes payable in respect of any Finance Document.",,Full Lifecycle,Financial,Financial - Informative,Commercial,Transaction Fees And Charges,,,Event Based,Demand Day,3,,,Medium,
Facility Agreement,13,"The Borrower shall, within 3 (three) Business Days of demand, indemnify each Finance Party against any cost, loss or liability incurred by that Finance Party as a result of:

(i)	the occurrence of any Event of Default;
(ii)	the information produced or approved by the Borrower being or being alleged to be misleading and/or deceptive in any respect;
(iv)	a failure by the Borrower to pay any amount due under a Finance Document on its due date or in the relevant currency, including without limitation, any cost, loss or liability arising as a result of Clause 27(Payment);",,Full Lifecycle,Financial,Financial - Informative,Default,Event of Default,,,Event Based,Event Date,3,,,Medium,
Facility Agreement,13,"The Borrower shall, within 3 (three) Business Days of demand, indemnify each Finance Party against any cost, loss or liability incurred by that Finance Party as a result of:
(iii)	any enquiry, investigation, subpoena (or similar order) or litigation with respect to the Borrower or with respect to the transactions contemplated or financed under this Agreement;",,Full Lifecycle,Legal,Financial - Informative,Litigation,"Legal Notice, Litigation",,Legal Notice Copy,Event Based,Event Date,3,,,Medium,
Facility Agreement,13,"The Borrower shall, within 3 (three) Business Days of demand, indemnify each Finance Party against any cost, loss or liability incurred by that Finance Party as a result of:
(vi)	the Loan (or part of a Loan) not being prepaid in accordance with a notice of prepayment given by the Borrower.

(vii)	all costs, charges and out of pocket expenses incurred by the Finance parties in connection with the preparation, execution and perfection of any of the Finance Documents and securities contemplated for the Facility.",,Full Lifecycle,Financial,Financial - Informative,Commercial,Transaction Fees And Charges,,,Event Based,Event Date,3,,,Medium,
Facility Agreement,14.1,"14.1.	Transaction expenses

The Borrower shall, within 3 (three) Business Days of demand, pay the Agent and the Security Trustee the amount of all costs and expenses (including legal fees) reasonably incurred by any of them in connection with the negotiation, preparation, printing, execution and syndication of:

(i)	this Agreement and any other documents referred to in this Agreement; and

(ii)	any other Finance Documents executed after the date of this Agreement.",,Full Lifecycle,Financial,Financial - Informative,Commercial,Transaction Fees And Charges,,,Event Based,Demand Day,3,,,Medium,
Facility Agreement,14.2,"14.2.	Amendment costs

If the Borrower requests an amendment, waiver or consent, the Borrower shall, within 3 (three) Business Days of demand, reimburse the Agent and the Security Trustee for the amount of all costs and expenses (including legal fees) reasonably incurred by the Agent or the Security Trustee (as the case may be) in responding to, evaluating, negotiating or complying with that request or requirement.",,Full Lifecycle,Financial,Financial - Informative,Commercial,Transaction Fees And Charges,,,Event Based,Demand Day,3,,,Medium,
Facility Agreement,14.3,"14.3.	Enforcement costs

The Borrower shall reimburse within 3 (three) Business Days and pay to the each Finance Party the amount of all costs, charges and expenses, including any fee charged by solicitors or advocates, company secretaries, stamp duty and legal costs on actual basis and other c arges & expenses which may be incurred by the Lenders for the enforcement or attempted enforcement
of the security to be created in terms of this Agreement.",,Full Lifecycle,Financial,Financial - Informative,Commercial,Transaction Fees And Charges,,,Event Based,Demand Day,3,,,Medium,
Facility Agreement,14.4,"14.4.	Agent's and/or Security Trustee's Expenses

(i)	The Borrower shall promptly on demand pay the Security Trustee the amount of all costs and expenses (including legal fees) reasonably incurred by the Security Trustee in connection with the administration or release of any Transaction Security.",,Full Lifecycle,Security,Financial - Informative,Commercial,Transaction Fees And Charges,,Transaction Expense Documents,Event Based,Demand Day,3,,,,
Facility Agreement,15.3,"(iii)	If, on the Notice Day, the aggregate of the credit balances of the DSRA is less than the Minimum DSRA Balance, the Borrower must promptly deposit sufficient additional funds to the DSRA before the first day of that next quarter to ensure that the aggregate of the credit balances of the DSRA is an amount at least equal to the Minimum DSRA Balance.",,Full Lifecycle,Financial,Financial -Affirmative,Security,DSRA,,Security Documents,Quarterly,COD,,,,,
Facility Agreement,15.3,"(i)	The Borrower shall procure forthwith till the payment of the Loan, interest and any other outstanding or dues under the Finance Documents, the aggregate of the credit balances of the DSRA is not less than the Minimum DSRA Balance.

(ii)	The Agent will notify the Borrower no later than one Business Day before the first day of each quarter (the ""Notice Day"") of the Minimum DSRA Balance.
""Minimum DSRA Balance"" means an amount equivalent to ensuing 3 (three) months repayment of Loans and interest obligations under the Facility Agreement;",,Full Lifecycle,Financial,Financial -Affirmative,Ratios,DSRA,,Financial Ratio Computations,Quarterly,26/11/11,,,,,
Facility Agreement,15.4,"15.4.	Withdrawals

(i)	No withdrawal or transfer from the DSRA may be made if to do so would cause the DSRA to be overdrawn.

(ii)	On the date of each withdrawal made by the Borrower from the DSRA the Borrower will be deemed to represent and warrant that no Default has occurred which is continuing and no Default will occur as a result of the withdrawal.

(iii)	None of the restrictions contained in this Clause 15.4 on the withdrawal of sums standing to  the  credit of the DSRA shall affect the obligations of the Borrower to make any payment or repayment required to be made under the Finance Documents on the date the same is so required to be made.

(iv)	Except as otherwise provided in any Security Document, no sum may be transferred or withdrawn from the DSRA except as expressly permitted by this Clause 15.4.

(v)	No dividend shall be declared if the aggregate,of the credit balances of the DSRA is less than the Minimum DSRA Balance.",,Full Lifecycle,Financial,Financial -Affirmative,Ratios,DSRA,,Financial Ratio Computations,Quarterly,26/11/11,,,,,
Facility Agreement,16.1,"16.1.	Status

(i)	It is a company, duly incorporated and validly existing under the laws of India.

(ii)	It and each of its Subsidiaries has the power to own its assets and carry on its business as it is being conducted.",,Full Lifecycle,Informative,Non Financial - Informative,Representations & Warranties,Leally Incorporated,,Certificate from authorized officer,Quarterly,26/11/11,,,,,
Facility Agreement,16.3,"The entry into and performance by it of, and the transactions contemplated by, the Finance Documents do not and will not conflict with:

(i)	any law or regulation applicable to it;

(ii)	its constitutional documents; or

(iii)	any agreement or instrument binding upon it or any of its assets.",,Full Lifecycle,Legal,Non Financial - Negative,Representations & Warranties,Applicable Laws,,Certificate from authorized officer,Quarterly,26/11/11,,,,,
Facility Agreement,16.4,"16.4.	Power and authority

(a)	It does not suffer from any statutory or legal infirmities affecting the pursuit or running of its business/ undertaking.

(b)	It has the power to enter into, perform and deliver, and has taken all necessary action to authorise its entry into, performance and delivery of, the Finance Documents to which it is a party and the transactions contemplated by those Finance Documents.

(c)	No limit placed on it or the powers of its directors will be exceeded as a result of the borrowing, granting of Security or indemnities contemplated by the Finance Documents to which it is a party.",,Full Lifecycle,Legal,Non Financial - Affirmative,Representations & Warranties,Applicable Laws,,Certificate from authorized officer,Quarterly,26/11/11,,,,,
