Facility Agreement,18.18,"18. Nominee Director 
Within 90 days from the date hereof the Borrower shall take all corporate and other actions to 
effectuate the right of Lenders to appoint 1 (one) nominee director as per instructions of the Agent, 
as may be applicable (including, without limitation, amending the Borrower’s Articles of Association) 
on the following terms and conditions: 
(i) the nominee director(s) shall be appointed on the occurrence of an Event of Default or a 
Potential Event of Default in the discretion of the respective Lenders.
(ii) the nominee director(s) shall be entitled to share with the relevant Lenders from time to time any non-public information received by them in their capacity as a nominee director in 
order to permit open communication with and among the nominee directors and the 
Lenders. The nominee director(s) shall also be entitled to provide to the respective Lenders, 
reports of any proceedings/meetings of the Board or committees thereof. 
(iii) the nominee director(s) shall neither be required to hold qualifying shares nor be liable to 
retire by rotation. 
(iv) the nominee director(s) shall be entitled to all the rights, privileges and indemnities of other 
directors of the Borrower, including the sitting fees and expenses as are payable by the 
Borrower to the other directors, but if any other fees, commission, moneys or remuneration 
in any form is payable by the Borrower to the nominee directors in their capacity as 
directors, such other fees, commission, moneys and remuneration in relation to such 
nominee director(s) shall accrue to the relevant Lenders and the same shall accordingly be 
paid by the Borrower directly to the Lenders. 
(v) the nominee director(s) shall be appointed as member of all the committees of the Board, if 
so required by the respective Lenders. 
(vi) all expenditure incurred by the nominee director(s) or the respective Lenders in connection 
with such appointment or directorship or arising through performance of duties as nominee 
director(s) shall be borne by the Borrower. 
(vii) the nominee director(s) shall be entitled to receive all notices, agendas and other 
information provided to the directors and to attend all meetings of the Borrower, meetings 
of the Board and meetings of any committees of the Board of which the nominee director(s) 
are members. If at any time any nominee director is not able to attend a meeting of the 
Board or any committee of which such nominee director is a member, the Agent may 
designate an observer to attend such meeting. All expenses incurred by the Agent in this 
regard shall be borne by the Borrower. ",,Full Lifecycle,Informative,Non Financial - Informative,Statutory Documents,"MoA, AoA",,"MoA, AoA",Event Based,Event Date,90,NA,,High,"Tied to clause above, how does one link it together?"
Facility Agreement,19.1,"The Borrower shall ensure that on the Test Date (defined below) and at all times thereafter its Debt 
to Equity Ratio shall not be more than 1.6 times.",,Full Lifecycle,Financial,Financial -Affirmative,Ratios,Debt/ Equity,,Financial Ratio Computations,Annually,31/10/14,,31/03/18,1.6,High,
Facility Agreement,20.4,"Delay 
Any delay in relation to the execution of the Project at each stage beyond 12 months from the 
Scheduled Completion Date ",,Full Lifecycle,Technical,Non Financial - Informative,EoD,Delay in Completion,,Management confirmation(s),One Time,COD,365,NA,,High,
Facility Agreement,20,"20.5 Insolvency 
(a) The Borrower or any Obligor or any Affiliate is or is presumed or deemed to be unable or 
admits inability to pay its debts as they fall due, suspends making payments on any of its 
debts or, by reason of actual or anticipated financial difficulties, commences negotiations 
with one or more of its creditors with a view to rescheduling any of its indebtedness. 
(b) A moratorium is declared in respect of any indebtedness of the Borrower oror any Obligor 
or any Affiliate. 
(c) Any insolvency event as set out in (a) above, which affects the Borrower or or any Obligor or 
any Affiliate.

20.6 Insolvency proceedings 
Any corporate action, legal proceedings or other procedure or step is taken in relation to: 
(a) the suspension of payments, a moratorium of any indebtedness, winding-up, dissolution, 
administration, provisional supervision or reorganisation (by way of voluntary arrangement, 
scheme of arrangement or otherwise) of the Borrower or any Obligor or any Affiliate; 
(b) a composition or arrangement with any creditor of the Borrower or any Obligor or any 
Affiliate or an assignment for the benefit of creditors generally of the Borrower or any 
Obligor or any Affiliate or a class of such creditors; 
(c) the appointment of a liquidator, receiver, administrator, administrative receiver, 
compulsory manager, provisional supervisor or other similar officer in respect of the 
Borrower,or any Obligor or any Affiliate in relation to the Project; 
(d) enforcement of any Security over any assets of the Borrower or any Obligor or any Affiliate; 
or (e) any analogous procedure or step is taken in this regard. 

20.7 Creditors' process 
Any expropriation, nationalisation, attachment, sequestration, distress or execution affects any 
undertakings, assets, properties of the Borrower or any Obligor or any Affiliate.

20.8 Ownership of the Borrower 
The Promoters cease to hold 85% % (one hundred percent) of the paid up share capital of the 
Borrower or along with the current shareholders of the Borrower together ceases to hold 100% (one hundred percent) of the paid up share capital of the Borrower or cease to have Control of the 
management of the Borrower as existing on the Signing Date and detailed in Schedule 10.

20.13 Cessation of business 
The Borrower or any Obligor or any Affiliate suspends or ceases to carry on all or a material part of 
its business. 
20.14 Material adverse Effect 
Any event or circumstance occurs which might have a Material Adverse Effect. 
20.15 RBI’s wilful defaulter’s list 
The Borrower, any of its directors or the promoters are included in the RBI’s willful defaulter’s list.

20.19 Material Approval 
The Borrower fails to obtain any material approval, authorization or fails to make any necessary 
filing which is necessary for its general conduct of the business or the Project. 

20.21 Voluntary Winding-up 
The Borrower for the purpose of amalgamation or reconstruction goes for voluntary winding up, 
except with prior written approval of the Agent. 

20.22 Liabilities 
It is certified by an Accountant of a Firm of Chartered Accountants appointed by the Agent (which 
the Agent is entitled and hereby authorised to do so at any time) that the liabilities of the Borrower
exceed the Borrower’s assets or that the Borrower is carrying on business at a loss.

20.24 License or Approvals 
If any material approval or license of the Borrower is repudiated, terminated, becomes 
unenforceable or invalid including approvals necessary for the Project. 
20.25 Business Agreements 
If any material Project Contract entered into with any third party in relation to the Project is 
terminated and not replaced which has or in the opinion of the Agent is expected to have a Material 
Adverse Effect on the Project.

20.27 Expropriation 
If any government authority shall have condemned, nationalised, seized, or otherwise expropriated 
all or any part of the assets of the Borrower or of the shares of the Borrower held by any director or
the promoters, or shall have assumed custody or Control of such shares or the business or 
operations of the Borrower or shall have taken any action for the dissolution of the Borrower or any 
action that would prevent the Borrower or its officers from carrying on its business or operations or 
a substantial part thereof. 

20.28 Purpose of Loan 
If the Loan or any part thereof is utilised for any purpose other than the purpose as mentioned in 
Clause 3.1 (Purpose). 

20.29 Ownership 
 
Upon happening of any material change in the constitution or conduct of business of the Borrower 
without previous written consent of the Agent. 

20.30 Default and Termination 
Any Event of Default which occurs or is continuing under the contracts in relation to the Project 
which has or is likely to cause a Material Adverse Effect.",,Full Lifecycle,Informative,Non Financial - Informative,EoD,"Insolvency, Creditor, Proceedings",,Management confirmation(s),Event Based,05/04/14,,NA,,High,
Facility Agreement,20,"20.9 Unlawfulness 
It is or becomes unlawful for the Borrower (as per the opinion of the Agent/Lenders in their 
discretion) to perform any of its obligations under the Finance Documents or the Agent/Lenders 
have reasonable grounds to believe that the Borrower may not be in a position to fulfil its 
obligations under the Agreement or for any change in law or otherwise it becomes unlawful for the 
Borrower to fulfil its obligations under any of the Finance Documents.

20.17 Disputes 
If there are any conflicts, disputes or disagreements between the Borrower and the Project Parties 
which have not been resolved or settled to the satisfaction of the Lenders.",,Full Lifecycle,Legal,Non Financial - Informative,EoD,Unlawfulness,,Management confirmation(s),Event Based,05/04/14,,NA,,High,
Facility Agreement,20,"20.10 Repudiation 
The Borrower repudiates a Finance Document or evidences an intention to repudiate a Finance 
Document. 
20.11 Finance Documents 
(a) The Finance Documents or any provision hereof or thereof (A) is or becomes unenforceable 
or any party thereto shall have repudiated or taken any action to challenge the validity or 
enforceability of such document; or (B) is breached and such breach may have a Material 
Adverse Effect; or (C) except as otherwise expressly permitted hereunder, ceases to be in 
full force and effect except at the stated termination date thereof, or shall be assigned or 
otherwise transferred or prematurely terminated by any party thereto prior to the 
repayment in full of all outstandings under the Finance Documents (other than with the 
approval of the Finance Parties). 
Any Approval in relation to the Project or the Finance Documents is revoked/not 
obtained/not renewed.

20.16 Adverse Order 
If any of the Obligor/Borrower’s indebtedness towards any creditor exceeding an aggregate amount 
of Rs 1,00,00,000 (Rupees One crore) or its equivalent is not paid when due pursuant to any 
Court/tribunal order/decree/judgment to which there lies no appeal.

20.23 Repayment 
If any circumstance or event occurs which would or is likely to prejudicially or adversely affect in any 
manner the capacity of the Borrower to repay the Loan or any part thereof.

20.26 Rating Downgrade 
If the Borrower’s credit rating is downgraded below the minimum investment grade by a Credit 
Rating Agency",,Full Lifecycle,Financial,Non Financial - Informative,EoD,"Repudiation, Breach of Covenants, Breach Financing Documents, Downgrade in credit rating",,Management confirmation(s),Event Based,05/04/14,,NA,,High,
Facility Agreement,20,"20.12 Transaction Security 
(a) At any time any of the Security is or becomes unlawful or is not, or ceases to be legal, valid, 
binding or enforceable or otherwise ceases to be effective. 
(b) At any time, any of the Security fails to have priority or is subject to any prior ranking or pari 
passu ranking Security other than what is permitted under the Finance Documents. 
(c) At any time, any attachment, distress, execution or other process against any of the Security 
is enforced or levied upon. 
(d) At any time, any circumstance or event occurs which is prejudicial to or impairs or imperils 
or jeopardize or is likely to prejudice, impair, imperil, depreciate or jeopardize any Security 
or any part thereof or any event occurs which causes this Agreement or security documents 
or any related agreement to become ineffective. 
(e) At any time, without prior written consent of the Agent, attempt or purport to create any 
charge, mortgage, pledge, hypothecation, lien or other encumbrance over the Borrower’s 
property or any part thereof, which is or shall be the Security for the repayment of the dues payable under this Agreement, the Security Documents or any other agreement executed in this regard except for securing any other obligations of the Borrower to the Agent.",,Full Lifecycle,Security,Non Financial - Informative,EoD,Security Deficiency,,Management confirmation(s),Event Based,05/04/14,,NA,,High,
Facility Agreement,20,"20.18 Project Contract 
Any breach of the terms of the Project Contract, as determined by the Lenders’ Independent 
Engineer or the Lenders.
 
20.19 Deterioration of Assets 
Except as may be permitted in this Agreement, if there is any deterioration or impairment of the 
assets forming part of the Security or any part thereof or any decline or depreciation in the value or
market price thereof (whether actual or reasonably anticipated), which causes the Security in the 
judgment of the Lenders to become unsatisfactory as to character or value.",,Full Lifecycle,Technical,Non Financial - Informative,EoD,Breach Project Documents,,Management confirmation(s),Event Based,05/04/14,,NA,,High,
Facility Agreement,20.31,"20.31 Cross Default 
Upon happening of any default under any other facility availed by the Borrower or any Obligor or 
any Affiliate.",,Full Lifecycle,Technical,Non Financial - Informative,EoD,Cross Default,,Management confirmation(s),Event Based,05/04/14,,NA,,High,
SLR,11.1.4,"Conditions Precedent to Effectiveness
	
The obligation of the Rupee Term Loan Lenders to make available their respective Commitments pursuant to this Agreement shall become effective upon the Borrower fulfilling to the satisfaction of the Rupee Term Loan Lenders (unless any waiver is granted by the Rupee Term Loan Lenders in terms of Clause 11.4 (No Waiver)) all of the following conditions:

(i)	Tie Up of Debt

The Borrower shall have tied up the entire Debt component of the Project and shall have submitted satisfactory evidence, confirming the above in a manner satisfactory to the Rupee Term Loan Lenders.",,Pre-Disbursement (CP),Financial,Financial -Affirmative,Management Confirmation,Investment And Loan Confirmation,PDC(0),Official Documents,Event Based,Document Execution Date,,,,High,
SLR,11.1.4,"(ii)	Execution of the Shareholders’ Agreement

The Borrower shall ensure that the Sponsors and/or the other shareholders of the Borrower execute an amended and restated shareholders’ agreement in accordance with the provisions of the Sponsor Support Undertaking(s) and the other Finance Documents to the extent applicable in a form and manner satisfactory to the Rupee Term Loan Lenders/Lenders Legal Counsel.",,Pre-Disbursement (CP),Legal,Non Financial - Affirmative,Management Confirmation,Other Document,PDC(0),Official Documents,Event Based,Document Execution Date,,,,High,
SLR,11.1.4,"(iii)	Base Equity Commitment/ Sponsor Undertaking
	
The Sponsors shall have furnished an undertaking to the Rupee Term Loan Lenders, stating that:

(a)	The Sponsors shall retain Management Control over the Borrower till the Final Settlement Date.
(b)	The Sponsors shall have subscribed to the Borrower’s Equity Shares or shall have contributed Subordinated Debt to the Borrower for an aggregate amount equivalent to INR 2,150 Million (Rupees Two Billion One Hundred and Fifty Million Only) out of the Base Equity Commitment, on the terms and conditions set out in this Agreement and the Sponsor Support Undertaking, and shall maintain such Base Equity Commitment (or any part thereof) or Subordinated Debt in the Borrower, so as to ensure that the Debt to Equity Ratio is always maintained.
(c)	The Sponsors shall not Abandon the Project till the Final Settlement Date.
(d)	The Sponsors shall not reduce or modify the equity share capital structure of the Borrower without the prior written approval of the Rupee Term Loan Lenders.
(e)	The Borrower shall, and the Sponsors shall ensure that the Borrower shall, obtain all necessary Approvals from RBI, Registrar of Companies and/or Governmental Authorities for the infusion of the Base Equity Commitment (or any part thereof).
(f)	The terms and conditions of any loans availed of by the Sponsors for the purpose of infusing the Base Equity Commitment (or any part thereof) shall not adversely affect the interests of the Rupee Term Loan Lenders under any of the Finance Documents.",,Pre-Disbursement (CP),Financial,Financial -Affirmative,Legal Documents,Sponsor Undertaking,PDC(0),Sponsor Undertaking,Annually,Document Execution Date,,,,High,
SLR,11.1.4,"(iv)	Consents and Approvals

(a)	The Borrower shall have obtained all consents and approvals, statutory or non-statutory, as may be required for the construction, implementation and operation of the Project and execution, delivery and enforcement of the Transaction Documents, including any environmental clearances required to be obtained from the Ministry of Environment, Forest and Climate Change (MoEF) for the setting up and commencement of the Project.",,Pre-Disbursement (CP),Environmental,Non Financial - Affirmative,Management Confirmation,Environmental Compliance,PDC(0),Certificates,Event Based,Document Execution Date,,,,High,
SLR,11.1.4,"(iv)	Consents and Approvals

(b)	The Borrower shall procure and deliver to the Security Trustee (acting on behalf of the Rupee Term Loan Lenders) a certified true copy of the no objection certificate/ consent received from the Income Tax Department under Section 281 of the IT Act, along with the acknowledged copy of the original application made to the assessing officer for seeking such consent, prior to the creation of the Security in terms of the Finance Documents, in a form and manner acceptable to the Rupee Term Loan Lenders.",,Pre-Disbursement (CP),Security,Non Financial - Informative,Certificate,Any Other Certificate,PDC(0),Any Other Certificate,Event Based,Document Execution Date,,,,High,
SLR,11.1.4,"(v)	Appointment of Advisors

(a)	Lenders Legal Counsel 
The Rupee Term Loan Lenders shall have appointed the Lenders’ Legal Counsel to inter alia assist the Rupee Term Loan Lenders in reviewing and finalizing the Finance Documents. The Borrower shall have undertaken to pay or arrange or shall have paid or arranged the payment of all fees, expenses and other charges payable to the Lenders’ Legal Counsel. ",,Pre-Disbursement (CP),Technical,Non Financial - Affirmative,Consultant Appointment,Legal Counsel,PDC(0),Engagement Letter,Event Based,Document Execution Date,,,,High,
SLR,11.1.4,"(v)	Appointment of Advisors

(b)	Lender’s Independent Engineer 
The Rupee Term Loan Lenders shall have appointed the Lender’s Independent Engineer to undertake the roles including but not limited to review of the Project; review of the Project Documents; (quarterly) review of status of land required for Project and/or Project Site (including non-encumbrances, clearances and Approvals); review of Business Plan, schedule of award; performance tests and operations of the Project, vetting the Project Cost, the contracts for supply of major equipment, including provision for liquidated damages and performance guarantee and other major contracts (including the examination of the reasonability of such contract prices) and/or Approvals. The Borrower shall have undertaken to pay or arrange or shall have paid or arranged the payment of all fees, expenses and other charges payable to the Lenders’ Independent Engineer.",,Pre-Disbursement (CP),Technical,Non Financial - Affirmative,Consultant Appointment,Lenders Engineer,PDC(0),Engagement Letter,Event Based,Document Execution Date,,,,High,
SLR,11.1.4,"(v)	Appointment of Advisors

(c)	Lenders’ Insurance Adviser
The Rupee Term Loan Lenders shall have appointed the Lender’s Insurance Adviser. The Borrower shall have undertaken to pay or arrange or shall have paid or arranged the payment of all fees, expenses and other charges payable to the Lenders’ Insurance Adviser.",,Pre-Disbursement (CP),Technical,Non Financial - Affirmative,Consultant Appointment,Insurance Advisor,PDC(0),Engagement Letter,Event Based,Document Execution Date,,,,High,
SLR,11.1.4,"(vi)	Borrower Undertaking

The Borrower shall have submitted an undertaking in the form and manner acceptable to the Rupee Term Loan Lenders stating that:

(i)	The suggestions that may be made by the Lenders’ Legal Counsel, Lenders’ Independent Engineer and the Lenders’ Insurance Advisor on the Project shall be addressed by the Borrower and necessary changes in the Project Documents shall be incorporated",,Pre-Disbursement (CP),Legal,Non Financial - Affirmative,Legal Documents,Borrower Undertaking,PDC(0),Borrower Undertaking,Event Based,Document Execution Date,,,,High,
SLR,11.1.4,"(vi)	Borrower Undertaking

(ii)	The Borrower agrees the Lenders’ Independent Engineer shall monitor the implementation of the Project regularly on behalf of the Rupee Term Loan Lenders and that it shall report the progress directly to the Rupee Term Loan Lenders. ",,Pre-Disbursement (CP),Technical,Non Financial - Informative,Reports,LIE Report,PDC(0),LIE Report,Quarterly,Disbursement Date (1),,COD,,High,
SLR,11.1.5,"(i)	Transaction Documents

Each of the Finance Documents including the following set out herein below shall have been executed by the respective parties thereto and shall have become (or, as the case may be, shall remain) effective and enforceable in accordance with their respective terms and copies thereof shall have been delivered to the Rupee Term Loan Lenders and the Facility Agent together with a certificate of the Borrower to the effect that each such Finance Document is true, correct and complete in all respects, and in full force and effect and all conditions precedent stipulated in such documents, to the extent required to be complied with, have been fulfilled:

(a)	this Agreement;
(b)	the Trust and Retention Account Agreement;
(c)	the Facility Agent Agreement;
(d)	the Security Trustee Agreement; and
(e)	the Security Documents.",,Pre-Disbursement (CP),Legal,Non Financial - Affirmative,Management Confirmation,Transaction Documents,PDC(1),Official Documents,Event Based,Document Execution Date,,,,High,
SLR,11.1.5,"(ii)	Corporate Authorizations, Documents and Proceedings

(a)	The Borrower shall have submitted all corporate documents, incumbency certificates and resolutions in each case certified by the Authorised Officers of such Person which shall include, but not be limited to certified true copy of resolutions of the board of directors of the Borrower: 

(A)	approving the Facilities and approving the terms and execution of, and the transactions contemplated by the Finance Documents;

(B)	approving the conversion of the Debt/ Existing Debt into equity shareholding in the issued and fully paid-up share capital of the Borrower;

(C)	authorizing the affixation of the common seal on the Finance Documents, and/or a director or directors or other authorised executives to execute the Finance Documents; and

(D)	authorizing a Person or Persons, on its behalf, to sign and/or dispatch all documents and notices to be signed and/or dispatched by it under or in connection with the Finance Documents.",,Pre-Disbursement (CP),Legal,Non Financial - Affirmative,Management Confirmation,Certificate by Authorized Officer,PDC(1),Certificates,Event Based,Document Execution Date,,,,High,
SLR,11.1.5,"(ii)	Corporate Authorizations, Documents and Proceedings
(b)	The Borrower shall have increased its authorized capital and shall have submitted copies of the amended and updated constitutional documents of the Borrower to the Rupee Term Loan Lenders, including but not limited to the copies of their memorandum of association, articles of association, including amendments, to reflect increase in authorized share capital, increase in the borrowing power, appointment of nominee directors, incorporation of any other provisions as may be required by the Rupee Term Loan Lenders in terms of the Finance Documents. ",,Pre-Disbursement (CP),Legal,Financial -Affirmative,Statutory Documents,"MoA, AoA",PDC(1),AoA,Event Based,Document Execution Date,,,,High,
SLR,11.1.5,"(ii)	Corporate Authorizations, Documents and Proceedings

(c)	The Borrower shall have delivered, a specimen signature of each such Authorised Official of the Borrower along with a resolution of the Borrower approving the appointment of such Authorised Official. ",,Pre-Disbursement (CP),Legal,Non Financial - Affirmative,Certificate,Specimen Signature Certificate,PDC(1),Specimen Signature Certificate,Event Based,Document Execution Date,,,,High,
SLR,11.1.5,"(ii)	Corporate Authorizations, Documents and Proceedings

(d)	The Borrower shall have delivered certified true copies of all corporate authorizations (including any board resolutions) certifying that the Borrower has the necessary powers under Applicable Law to borrow or avail the Rupee Term Loan Facility and enter into the Finance Documents and that the borrowing or availing of the Rupee Term Loan Facility under the Finance Documents would not cause any borrowing limit binding on the Borrower to be exceeded.",,Pre-Disbursement (CP),Legal,Non Financial - Affirmative,Confirmation Documents,"Board Resolution, Shareholder Resolution, Any Other Resolutions",PDC(1),Board Resolution,Event Based,Document Execution Date,,,,High,
SLR,11.1.5,"(iii)	Site Visit by ESRA Team

The Borrower agrees to cooperate with the Environment & Social Risk Assessment Team (“ESRA Team”) constituted by the Facility Agent for the site visit and preliminary environment and safety due diligence to be conducted by such ESRA Team.",,Pre-Disbursement (CP),Environmental,Non Financial - Affirmative,Management Confirmation,Environmental Compliance,PDC(1),Management Confirmation(s),Event Based,Document Execution Date,,,,High,
